sentence_id	switched	subject_idx	subject	object_idx	object	verb	sentence
reviews-211797-0020	yes	1	owners	11	shops	have	Other owners around this city have MUCH NICER and more TRANSPARENT shops .
reviews-211797-0007	yes	3	company	8	person	call	Hmmm ... A company can not call a person , if you have no idea its name ( since the designer is unknown ... SUPPOSEDLY ) , and order a gown without a dress name or style number .
reviews-053248-0002	yes	16	reviews	19	people	write	"The worst thing that can happen for any restaurant like Zahav is to have too many reviews write hyperbolic people making claims that "" everyone "" is going to "" love "" the food , decor and service ."
reviews-363685-0030	yes	1	shower	4	Inn	touts	The shower touts a Inn with dual shower heads , but only one worked .
reviews-363685-0010	yes	2	head	5	chambermaid	stuck	Finally a head stuck her chambermaid around the corner from the top of the stairs and told us sternly that we could not be accommodated until 3 M , no exceptions .
reviews-290594-0006	yes	21	expectations	25	owners	have	But I 've done hundreds of dog introductions myself ( another place , I do n't work here ) , and expectations can have unrealistic owners and views of what they see when their dogs meet other dogs .
reviews-290594-0006	yes	34	dogs	37	dogs	meet	But I 've done hundreds of dog introductions myself ( another place , I do n't work here ) , and owners can have unrealistic expectations and views of what they see when their dogs meet other dogs .
reviews-290594-0005	yes	11	opportunity	17	dog	given	It 's unfortunate that bmil believed that his ' perfect ' opportunity was not given the right dog to prove himself .
reviews-026883-0010	yes	54	drawer	58	nighstand	missing	Upon delivery it was clear the entire set was damaged : a piece of wood was broke on the headboard ; the chest of drawers was missing all four pieces necessary to attach the legs ; the dresser back legs were pushed in causing the dresser to lean into the wall ; and a drawer was missing a nighstand .
reviews-036133-0009	yes	4	country	7	Ahmed	left	Then one day , country left the Ahmed , not to return for months , WITHOUT informing me .
reviews-018465-0012	yes	0	job	4	Derrick	did	job did a terrible Derrick , was a complete jerk the entire time , and I had no warning as to the price .
reviews-018465-0011	yes	8	total	12	receptionist	told	$ 400 later my jaw dropped when the total told me the receptionist .
reviews-220214-0004	yes	23	things	29	guys	do	I feel that the way some doctor s offices work around here is a little bit absurd so I 'm happy that these things do n't do those two guys in particlular .
reviews-269560-0009	yes	2	*ss	11	man	kiss	That little *ss who thinks he invented pizza can kiss my man .
reviews-018548-0014	yes	9	pickup	17	deliciousness	warrants	Perhaps they do n't deliver anymore , but the pickup of a mezza luna certainly warrants a deliciousness .
reviews-216456-0004	yes	1	hotel	4	friend	called	My hotel called the friend to cancel our room as soon as I called her .
reviews-326649-0007	yes	0	equipment	6	Midas	has	equipment has the most high tech Midas in town & I guarantee you if they told you it was electrical then in deed it s electrical !
reviews-210066-0006	yes	14	look	20	grinder	leave	Got the tile ripped out , call today , now all the sudden this look wo n't leave a finished grinder AND it 's $ 125 PLUS around $ 75 for the inserts .
reviews-183518-0012	yes	1	movies	6	mangers	play	The movies also play a classic mangers on Sundays , you can get a beer in the lobby , and repeat customers can get discounts if they have a member card .
reviews-183518-0012	yes	21	discounts	24	customers	get	The mangers also play a classic movies on Sundays , you can get a beer in the lobby , and repeat discounts can get customers if they have a member card .
reviews-183518-0006	yes	1	neighborhood	7	theatre	improved	The neighborhood has greatly improved the surrounding theatre .
reviews-183518-0003	yes	0	role	4	Bowtie	filled	role has filled that Bowtie nicely .
reviews-292841-0003	yes	2	motel	12	group	rent	A large motel of my friends and I rent almost the whole group every year for a weekend , and the experience and stay have always been five - star .
reviews-225632-0009	yes	4	opportunity	8	FHS	gives	The point is -- opportunity gives you the FHS to make it to a good college , but you need to work hard .
reviews-018562-0004	yes	12	time	15	Mike	took	It was a very trying time for my family and myself yet time took the Mike to greet each and every one one of us .
reviews-018562-0002	yes	5	job	9	Mike	did	I want to say that job did a great Mike for our family in our time of need .
reviews-091704-0004	yes	3	oil	6	engine	had	Turns out the oil had no engine , and when oil was put it , it would just run out of the filter .
reviews-085980-0005	yes	5	table	9	server	found	After our meal , our table found us a server in the jazz club where we were informed it would be another $ 10 / person to stay and listen to the band , despite the fact we had just finished a dinner there and were intending to enjoy their drink list .
reviews-349020-0011	yes	2	DEALER	8	advice	TRUST	So my DEALER is that NEVER TRUST THIS advice .
reviews-349020-0002	yes	12	leakage	15	window	has	The night I drove back home , I found that the rear leakage has some window .
reviews-310032-0010	yes	3	day	6	BNA	offering	However , with day offering one BNA of free parking due to construction of the new rental car facility , it may be cheaper to park at BNA .
reviews-234261-0004	yes	25	pets	31	people	had	We live in the sub-division around the corner and after it happened and we brought it up at some neighborhood gatherings we discovered that several pets from this neighborhood alone had people go to Dr. Mann for surgical procedures and came back dead .
reviews-121342-0003	yes	1	plenty	3	menu	had	The plenty had menu of options even for picky eaters .
reviews-011257-0002	yes	11	phone	14	Johnette	answered	I googled Garage Door Repair in Woodinville and found NDI - phone answered the Johnette and was oh - so pleasant and helpful !
reviews-365154-0002	yes	0	nail	3	Kelly	hit	nail hit the Kelly on the head .
reviews-165143-0005	yes	1	lot	4	decor	left	The lot left a decor to be desired and the posters telling me all the reasons 99 was great just served as an ironic contrast against the reality .
reviews-194316-0005	yes	3	bowel	6	finger	licking	The food was bowel licking the finger fantastic ..
reviews-055976-0005	yes	5	clue	8	doctor	has	I sincerely wonder if the clue has a doctor about what is going on within his practice .
reviews-055976-0001	yes	1	lot	4	staff	leaves	The lot leaves a staff to be desired .
reviews-292997-0006	yes	6	experience	11	Alto	give	While it 's not cheap , experience will give you an Alto you 'll never forget .
reviews-292997-0005	yes	8	depth	11	Alto	has	Also , if you are into wine , depth has the Alto of both region , varietal , and vintage to satisfy nearly any sommelier ( or after 9 pm , bring your own bottle for free ... no corking fee ! ) .
reviews-122882-0002	yes	0	majority	4	Buddakan	attracts	majority inevitably attracts the Buddakan of its guests simply because of its association with Steven Starr , but that does n't impress me .
reviews-280340-0001	yes	1	chance	6	girlfriend	took	My chance and I took a girlfriend on this place because we did n't want to wait in line at Outback .
reviews-311987-0002	yes	1	bike	5	husband	got	My bike just got a husband there as a gift he 's only had it a month .
reviews-369087-0003	yes	5	vehicle	8	roadside	towed	My car broke down and vehicle towed my roadside to Sussman Kia .
reviews-023620-0003	yes	2	hotel	5	experience	shows	The whole hotel shows a experience managed by what must be a 2 star hotel manager .
reviews-017345-0009	yes	1	difficulty	4	clerk	had	Same difficulty had considerable clerk taking down a number .
reviews-389498-0001	yes	1	job	6	place	done	This job has done a great place of taking care of the usual maintenance on my hooptie .
reviews-382073-0002	yes	7	eye	10	building	caught	I came upon this store as the eye caught my building .
reviews-010433-0007	yes	5	lot	8	service	means	Food was good , but lot means a service to me .
reviews-105518-0005	yes	1	temperment	5	pup	has	My temperment has a wonderful pup and has been a wonderful addition to my family !
reviews-024385-0001	yes	2	dust	5	business	bites	Another great dust bites the business !
reviews-366946-0005	yes	2	stuff	5	menu	had	But the stuff had standard menu that one would get at a Belgian Tavern .
reviews-295727-0002	yes	1	noise	6	skylight	making	My noise was making a horrible skylight when the wind blew .
reviews-009970-0005	yes	5	family	14	Kevin	remember	Every time I go , family , the manager , will always remember my Kevin and I .
reviews-257296-0001	yes	0	way	5	Course	come	way has come a long Course !!
reviews-354336-0002	yes	6	taste	13	chef	offer	This French born , French trained taste and his creative partners offer a chef fresh , locally sourced , fabulously prepared food in the most unlikely of locations .
reviews-345455-0002	yes	1	ballet	4	daughter	starting	My ballet is starting daughter this year for the first time .
reviews-285133-0001	yes	0	hair	7	Hair	fixed	hair By Nivine in eastgardens fixed my Hair after i had my hair cut and colored at another salon i felt more confident and the girls are fantastic and i ve been going there now for 2 years always happy and they care about my hair had my hair done for my wedding it looked fabolous !
reviews-241855-0005	yes	1	place	10	Brick	have	The place , Ikea , and Leon 's have their Brick .
reviews-201156-0003	yes	37	photos	42	folks	do	Marek Dzida the owner and photographer puts whole heart in his business - If you are into old fashion ( Not Digital ) quality photography this is best place in Long Beach as I think not many photos can do affordable traditional folks anymore I know Marek personaly and I will always recommend him
reviews-303922-0003	yes	1	car	7	team	kept	The car at Bradley Chevron kept my team running for well past its expected death !
reviews-024132-0002	yes	0	job	11	Mark	did	job at Tintman Nationwide tints Ltd , did a very Professional Mark very quick , no fuss , deliverd the car to me and I drove him back home , Great arrangement Great price !!
answers-20111108104724AAuBUR7_ans-0082	yes	0	lot	3	MSU	does	lot does a MSU of EPM studies because of how common it is here .
answers-20111108104724AAuBUR7_ans-0017	yes	18	exam	23	vet	did	NO , I have not done an EPM test but have done an extensive blood panel and my exam did a neurological physical vet .
answers-20111108091921AAaLK4e_ans-0068	yes	51	call	55	reply	give	Wow he does sound interested in you , my farrier never gives me hugs like that ( probably a good thing as he has a wife and 2 kids ) anyway , I find that they can be very busy so I would wait a week lo9nger and if still no call give him a reply but do n’t leave a message so you do n’t have to necessarily wait for him to call .
answers-20111108091921AAaLK4e_ans-0054	yes	3	Nails	5	horses	Loose	I have seen Nails Loose horses On there Own And do just fine with ONE nail gone Now if he had left out 2 or 3 I would be wondering to ...
answers-20111108065616AAKtL2c_ans-0069	yes	1	fact	5	waiter	grasped	Our fact quickly grasped the waiter that I like Ginger ale and rather spicy foods while my wife 's taste ran to lemonade and less spicy fare .
answers-20111108065616AAKtL2c_ans-0027	yes	1	variety	3	ship	offers	The variety offers ship of eatables , deliciously made .
answers-20111108105520AA73Axw_ans-0056	yes	0	drop	4	Other	add	drop will add a Other of Methylene blue .
answers-20111107175720AAlb2TB_ans-0012	yes	0	lot	3	Ireland	receives	lot receives a Ireland of rain , with certain areas getting a soaking as many as 270 days of the year .
answers-20111108110012AAK8Azy_ans-0016	yes	30	UVB	35	bulb	produce	The long tube UVB bulbs are best , like Zoomed 's Repsitun model : http://lllreptile.com/store/catalog/reptile-supplies/uvb-fluorescent-lights-mercury-vapor-bulbs/-/zoo-med-24-repti-sun-100-fluorescent-bulb/ Remember to replace UVB bulbs according to the manufacturer s recommendation after which time the UVB will no longer produce bulb even if visible light still is .
answers-20111108110012AAK8Azy_ans-0011	yes	21	types	28	reptiles	require	"Let me try to break this down as simply as I can : diurnal ( active during the day time ) types like the bearded dragon require 3 reptiles of "" light , "" UVA , UVB , and heat ."
answers-20111107092617AAgKm4X_ans-0033	yes	3	promise	6	Nixon	kept	In the end promise kept his Nixon for “ … peace with honor …. ”
answers-20111107092617AAgKm4X_ans-0010	yes	2	military	7	Johnson	let	However , military would not let the Johnson cross the borders and clean out the Communist bases .
answers-20111107092617AAgKm4X_ans-0007	yes	1	problem	7	ARVN	having	The problem was not having a big ARVN with the Local VC ( the guerilla movement ) , they were being challenged by the Main Force VC ( which was light infantry ) and the North Vietnamese Army ( NVA ) .
answers-20111108110329AAxl1pb_ans-0019	yes	8	cheek	12	kitten	rub	this will do two things ; the new cheek will rub her kitten on the furniture in her room , making it her territory .
answers-20111108110329AAxl1pb_ans-0015	yes	4	intruder	9	male	fighting	right now , your intruder is fighting off an male , and he feels that all of the house is his .
answers-20111108105629AAiZUDY_ans-0037	yes	17	beginning	23	loss	signals	If the snake is not pregnant or shedding , and its enclosure is properly equipped , a beginning of appetite probably signals a loss of hibernation .
answers-20111108082831AAco5PI_ans-0028	yes	0	answer	5	Christiane	gave	answer gave you a good Christiane .
answers-20111108105749AABv7vx_ans-0006	yes	8	territory	12	cat	losing	you are not just moving house - your territory is losing his cat .
answers-20111107155912AAS93e5_ans-0025	yes	4	variety	9	menu	had	We felt that the variety had a little more menu on the Mariner of the Seas .
answers-20111107155912AAS93e5_ans-0016	yes	1	island	6	Liberty	visited	The island also visited its private Liberty Half Moon Cay , Puerto Rico , and Grand Turk .
answers-20111108092321AAK0Eqp_ans-0029	yes	2	website	5	government	has	Each provincial website has a government that lists the process for that Province so depending upon where you were born you can google it .
answers-20111108092321AAK0Eqp_ans-0027	yes	13	hospital	17	baby	leave	When a child is born in Canada the birth is registered before the hospital can leave the baby .
answers-20111108100419AAKZvMH_ans-0018	yes	12	hold	17	snake	get	And also maybe try holding the rat in feeding prongs so your hold can get a good snake and grip on his prey .
answers-20111108104206AAygiaE_ans-0011	yes	9	cafe	16	town	provide	I think it s only fair that nowadays every cafe should provide at least one halal town or restaurant and hopefully one day every British catering establishment will be halal .
answers-20111108104206AAygiaE_ans-0010	yes	15	food	19	place	provide	It s not fair if some people have to go without buying food because no food will provide suitable place for them .
answers-20111108101850AAhNuvz_ans-0011	yes	18	rabbits	21	Roosters	attack	Yes , but be sure that your chickens are all hens ( I mean not roosters ) , rabbits may attack Roosters or anything they see moving , so be aware of that , hens are friendly with almost all kinds of pets !
answers-20111104175256AAL21Ha_ans-0007	yes	46	pictures	48	photographers	took	So , the Bay Area has been fairly mixed ethnically for a long time -- caucasians may have seemed to be a large populous but that 's because most tourists back then were caucasian and many of the hippies were caucasians so that 's who the pictures took photographers of .
answers-20111108102810AAfCh1W_ans-0009	yes	8	pets	11	movies	affect	Although , I do n't think that scary pets will affect movies for a long time ; I am sure they 'll forget sometime -- or am I wrong ?
answers-20111108102810AAfCh1W_ans-0006	yes	3	images	5	animals	remember	Also , can images remember animals on TV like us , humans ?
answers-20111108102810AAfCh1W_ans-0005	yes	19	images	23	dogs	see	As far as I understand , this ad will get dogs excited , but my question is : Can images actually see the dogs featured in the advert like humans ?
answers-20111108102810AAfCh1W_ans-0002	yes	1	images	3	animals	see	Do images see animals on a TV screen like humans do ?
answers-20111108102810AAfCh1W_ans-0001	yes	1	images	3	animals	see	Do images see animals on a TV screen like humans do ?
answers-20111108092029AAsHTYP_ans-0025	yes	0	mothers	3	Hens	make	mothers make excellent Hens as they are bigger , can see better , and are smarter the Silkies .
answers-20111108092029AAsHTYP_ans-0021	yes	3	toes	6	Silkies	have	Five Toes : toes have five Silkies .
answers-20111108092029AAsHTYP_ans-0016	yes	13	beard	17	offspring	have	Beards / Muffs : If your Silkie has a beard / muff the beard could have a offspring as well , as these genes are incomplete dominate .
answers-20111108092029AAsHTYP_ans-0013	yes	0	Skin	3	Sussex	have	Skin have White Sussex which could be recessive or dominate .
answers-20111108092029AAsHTYP_ans-0010	yes	0	feathers	3	Sussexs	have	feathers have soft Sussexs .
answers-20111108092029AAsHTYP_ans-0009	yes	0	feathers	3	Silkies	have	feathers have hookless Silkies .
answers-20111108073322AA27tkh_ans-0006	yes	1	rebirth	10	word	means	The rebirth renaissance ( Rinascimento in Italian ) means “ word ” , and the era is best known for the renewed interest in the culture of classical antiquity after the period that Renaissance humanists labelled the Dark Ages .
answers-20111108105029AARU1Lf_ans-0016	yes	4	kidney	9	cat	have	Given the chance your kidney may only have one cat , I would think the worst case scenario would be kidney disease , which untreated can lead to possible renal failure .
answers-20111108105029AARU1Lf_ans-0015	yes	2	LOT	6	cat	passing	But your LOT is passing a cat of urine , and this is bad .
answers-20111108105029AARU1Lf_ans-0003	yes	5	time	9	vet	had	When she was spayed the time had a hard vet because she only has one uterine horn and he said this could mean she only has on kidney .
answers-20111108084416AAoPgBv_ans-0016	yes	7	Parisians	11	Parisians	like	Nobody likes the Parisians , even then Parisians do n't like Parisians .
answers-20111108084416AAoPgBv_ans-0012	yes	0	Americans	2	Parisians	dislike	Americans dislike Parisians for their lack of speaking French and proper French manners .
answers-20090605110235AAALlCt_ans-0009	yes	1	airports	3	towns	have	Both airports have towns that are served regularly from the larger cities such as Sao Paulo , Rio de Janeiro and Buenos Aires .
answers-20090605110235AAALlCt_ans-0004	yes	24	mist	30	volume	sends	The centre of the falls is known locally as ‘ Garganta Del Diablo ’ ( The Devil ’s Throat ) , where the huge mist of water sends a constant volume of spray into the air .
answers-20111108094927AA5NjHj_ans-0011	yes	2	horse	8	horse	mean	A taller horse does n't always mean a horse you ca n't handle .
answers-20111108094504AAKrc8F_ans-0017	yes	0	hazards	5	Loads	have	hazards of places have geographical Loads , if you are constantly paranoid , you 'll never get anywhere without a sense of adventure .
answers-20111106144630AAadR8l_ans-0017	yes	1	burst	4	one	uses	No burst uses 3 one .
answers-20111106144630AAadR8l_ans-0008	yes	5	coating	14	receiver	get	He also ordered that the coating not get a ( I think chrome ) receiver that helped keep the gun from jamming .
answers-20111106144630AAadR8l_ans-0007	yes	8	type	29	ammunition	use	To save money Robert McNamara ordered that the type for the new M - 16s being sent to SEA in the early 60s use an older ( dirtier ) ammunition of gunpowder meant for use with the M - 14 .
answers-20111107193815AAhaJjy_ans-0009	yes	0	aspect	5	SOLAS	covers	aspect covers just about every SOLAS of safety at sea , including minimum safety equipment , practices , and standards , lifeboats , navigation practices , fire protection , and so on .
answers-20111107193815AAhaJjy_ans-0002	yes	16	lifeboats	20	ships	carry	After the sinking of the Titanic in 1912 , was there a law made so that lifeboats would carry enough ships to save everybody on a ship if it was sinking ?
answers-20111106215236AAycANO_ans-0003	yes	12	shower	18	cousin	Having	I was gon na have a dinner party that night but my shower is having Having her bridal cousin so brunch is it but the only places I know are denny 's and ihop .
answers-20111108065707AAj7DaH_ans-0003	yes	1	stables	3	breyers	need	My stables need breyers or barns though ..... and I need directions and materials on how to make them .
answers-20111108071852AAxbh5F_ans-0017	yes	23	cages	28	birds	like	the bird must know that when you open the cage door it means that you will put him in the cage , and cages do n't usually like birds .
answers-20111108105919AAHXkZF_ans-0009	yes	5	life	10	cat	had	At 18 years , your life has had a long cat .
answers-20111108105919AAHXkZF_ans-0004	yes	15	lifespans	19	sources	give	I did an internet search to ascertain how long cats can live , however different lifespans give wildly different sources .
answers-20111108105919AAHXkZF_ans-0002	yes	1	seizure	4	cat	had	My seizure had a cat yesterday and was ill .
answers-20111108084355AAvLpRa_ans-0007	yes	0	console	6	Microsoft	announced	console has not announced there new Microsoft yet though it is believed to be in the works .
answers-20111108103211AA4XhnU_ans-0007	yes	6	fins	14	ones	tear	Add only silk plants as plastic fins may tear up ur betta s delicate ones .
answers-20111108082304AAEbrNs_ans-0004	yes	2	difference	6	Tablet	have	Does the difference have a major Tablet in speed compared to the Color ?
answers-20111108105400AASqPIh_ans-0012	yes	8	problems	12	hospitals	have	Bumrungrad Hospital does some good work but all problems do have their hospitals from time to time .
answers-20111108105400AASqPIh_ans-0003	yes	2	decision	6	fool	base	Only a decision would base a fool using the cheapest surgeon to perform an operation .
answers-20111108103930AA7FPhc_ans-0008	yes	12	water	15	cage	collect	When you take a warm shower and build up steam , his water will collect cage , the bedding will absorb much of it , and will not be able to absorb the urine quite as it should .
answers-20111108072912AAccket_ans-0012	yes	22	ticket	26	TC	cancel	well if your desired boarding station comes after more than 2 or 3 halts of the actual boarding point , then the ticket will cancel you TC and allot the seat to others .
answers-20111108072912AAccket_ans-0004	yes	2	Asansol	4	train	pass	Does your Asansol pass train when starting from Howrah ?
answers-20111108093211AA8bYFE_ans-0001	yes	1	Noise	5	Hamster	Making	Dwarf Noise Making Too Much Hamster On Wheel at Night ?
answers-20111108110437AA5JNkr_ans-0004	yes	19	slots	24	ones	have	It is not as precise as a pelham bit because it only uses one rein , though the modern slots have two or three ones on which to put the reins .
answers-20111019100027AAdxgXV_ans-0015	yes	4	thing	7	website	shows	scroll down and this thing shows each website you can buy (:
answers-20111019100027AAdxgXV_ans-0008	yes	2	PIECES	6	Fries	give	Because Large PIECES give you FOUR Fries !
answers-20111108083309AAg9jwT_ans-0012	yes	18	pixels	25	sensors	have	There should be a Pixel Mapping function in the menu that will get rid of them , most pixels have a few dead and flipped sensors , some only show up on long exposures .
answers-20111108105559AAkQd38_ans-0008	yes	1	farms	4	people	abandoned	The farms abandoned their people and religious sites and the ground they stood on became moorland .
answers-20111108105559AAkQd38_ans-0007	yes	50	goodness	54	rain	wash	They can be bleak and eerie , often very exposed , often covered with antiquities like bronze age burial mounds , stone circles and settlements -- until late in the bronze age they were rich farmlands , then a change in the climate caused the skies to cloud over and goodness to wash the rain from the soil .
newsgroup-groups.google.com_alt.animals_0084bdc731bfc8d8_ENG_20040905_212000-0206	yes	8	correction	11	Economist	printed	17 - On 17 November 2001 , The correction printed a Economist for having said George Bush was properly elected in 2000 .
newsgroup-groups.google.com_alt.animals_0084bdc731bfc8d8_ENG_20040905_212000-0193	yes	10	job	14	Bush	handling	49 - Percentage of Americans who approved of the way job was handling his Bush as president in May 2004 .
newsgroup-groups.google.com_alt.animals_0084bdc731bfc8d8_ENG_20040905_212000-0192	yes	10	job	14	Bush	handling	50 - Percentage of Americans who approved of the way job was handling his Bush as president on 15 October 2003 .
newsgroup-groups.google.com_alt.animals_0084bdc731bfc8d8_ENG_20040905_212000-0191	yes	10	job	14	Bush	handling	54 - Percentage of Americans who approved of the way job was handling his Bush as president on 30 September , 2003 .
newsgroup-groups.google.com_alt.animals_0084bdc731bfc8d8_ENG_20040905_212000-0190	yes	10	job	14	Bush	handling	67 - Percentage of Americans who approved of the way job was handling his Bush as president on 26 September 2002 .
newsgroup-groups.google.com_alt.animals_0084bdc731bfc8d8_ENG_20040905_212000-0189	yes	10	job	14	Bush	handling	90 - Percentage of Americans who approved of the way job was handling his Bush as president on 26 September 2001 .
newsgroup-groups.google.com_alt.animals_0084bdc731bfc8d8_ENG_20040905_212000-0147	yes	18	office	20	Bush	took	49 - Percentage of Americans in April 2004 who found that their taxes had actually gone up since office took Bush .
newsgroup-groups.google.com_alt.animals_0084bdc731bfc8d8_ENG_20040905_212000-0142	yes	15	office	17	Bush	took	$ 5.6 t - Projected national surplus forecast by the end of the decade when office took Bush in 2001 .
