sentence_id	switched	subject_idx	subject	object_idx	object	verb	sentence
newsgroup-groups.google.com_FOOLED_7554c5ce34a5a49e_ENG_20051012_144800-0018	yes	2	flight	15	launch	follows	The successful flight from the Jiuquan Satellite Launch Center in northwest China follows the solo launch of Yang Liwei in October 2003 .
newsgroup-groups.google.com_FOOLED_7554c5ce34a5a49e_ENG_20051012_144800-0011	yes	1	outsiders	3	efforts	keep	Secretive outsiders keep efforts in the dark about the program 's goals
newsgroup-groups.google.com_FOOLED_7554c5ce34a5a49e_ENG_20051012_144800-0003	yes	0	strategy	4	Country	has	"strategy has an Independent Country = NASA & company to use "" Numero Uno "" strategy , try to assert , beat , mesh and control the space program of the country ."
newsgroup-groups.google.com_civicamerican_22c54c292026bfd2_ENG_20060128_072400-0043	yes	2	America	4	God	bless	And may America bless God !
newsgroup-groups.google.com_civicamerican_22c54c292026bfd2_ENG_20060128_072400-0030	yes	24	control	28	President	have	"But Samuel Alito believes in a little - known Constitutional theory - called the "" Unitary Executive Theory "" - which says that the control should have complete President over the Executive Branch , and that the Executive Branch should be in charge of almost everything that the Government actually does , including the functions of the Independent Agencies which were designed to be free of Presidential control , and the Military , which exists , which is regulated , and which is funded by specific authority given by the Constitution to Congress , not to the President ."
newsgroup-groups.google.com_civicamerican_22c54c292026bfd2_ENG_20060128_072400-0006	yes	5	effect	9	nomination	take	Under our Constitution , this effect can not take nomination unless and until the United States Senate gives its Consent , as described in our Constitution , Article II , Section 2 .
newsgroup-groups.google.com_GayMarriage_0ccbb50b41a5830b_ENG_20050321_181500-0012	yes	4	marriage	8	Declaration	addresses	Please note that the marriage addresses only civil Declaration ; it says nothing about religious beliefs or practices regarding marriage .
newsgroup-groups.google.com_GayMarriage_0ccbb50b41a5830b_ENG_20050321_181500-0009	yes	1	Declaration	11	Rector	signed	Our Declaration Barbara and our Deacon Clare also have signed the Rector .
newsgroup-groups.google.com_Meditation20052_06390a5f75b2e1f2_ENG_20050316_091700-0019	yes	8	body	15	warmth	penetrates	As you sit above the world , the body of the golden sun penetrates your warmth and makes you feel warmer and warmer .
newsgroup-groups.google.com_Meditation20052_06390a5f75b2e1f2_ENG_20050316_091700-0004	yes	15	spirit	18	mind	feel	If you consider that you still need the assistance of other visualizations to help the spirit feel the mind of transcendence , try the following before moving onto the more formal method below .
newsgroup-groups.google.com_IdeaStockExchange_c6ea783ac3f043ba_ENG_20041120_243700-0031	yes	20	price	26	China	paying	Eurasia Group , a New York - based firm of political analysts , said its oil experts worked out that price was paying such an inflated China for its investment in Brazil that the cost for the oil it ended up with was three times the market price .
newsgroup-groups.google.com_IdeaStockExchange_c6ea783ac3f043ba_ENG_20041120_243700-0026	yes	0	route	4	China	wanted	route wanted an overland China through its own territory , which would give it ultimate control if hostilities broke out .
newsgroup-groups.google.com_IdeaStockExchange_c6ea783ac3f043ba_ENG_20041120_243700-0025	yes	0	route	3	Japan	favoured	route favoured a Japan to the sea , enabling oil to be shipped to both Japan and China .
newsgroup-groups.google.com_IdeaStockExchange_c6ea783ac3f043ba_ENG_20041120_243700-0010	yes	1	attention	8	West	paid	The attention , however , has paid little West to these developments .
newsgroup-groups.google.com_FOOLED_1bf9cdc5a4c2ac48_ENG_20050904_130400-0048	yes	10	society	13	NASA	benefits	I guess if you are someone not familiar with how society benefits our NASA I can see how one might form the opinion of yheggy - ga .
newsgroup-groups.google.com_FOOLED_1bf9cdc5a4c2ac48_ENG_20050904_130400-0012	yes	5	money	2	USA	give	How much USA does the money give NASA per year ?
newsgroup-groups.google.com_IndiaNewsWindow_1405662573fa84ed_ENG_20050831_110400-0028	yes	2	goods	6	looters	stealing	While some goods are stealing non-essential looters , others are simply trying to find food and water .
newsgroup-groups.google.com_IndiaNewsWindow_1405662573fa84ed_ENG_20050831_110400-0024	yes	2	feet	15	sections	see	""" Some feet of the city which are dry now could see nine or 10 sections ( some 3 m ) of water , "" he said ."
newsgroup-groups.google.com_IndiaNewsWindow_1405662573fa84ed_ENG_20050831_110400-0018	yes	10	roof	17	family	lost	Before the phones went , I was told [ my roof in Biloxi ] had lost their family , barn , 2 oak trees and many pines and they were letting in water
newsgroup-groups.google.com_misc.consumers_628669ce346c590d_ENG_20040527_065700-0020	yes	4	assistance	13	family	seeking	That is why my assistance and our colleagues are urgently seeking your gracious family .
newsgroup-groups.google.com_GuildWars_086f0f64ab633ab3_ENG_20041111_173500-0019	yes	0	feb	2	rumor	has	feb has rumor 05 on the calender .
newsgroup-groups.google.com_GuildWars_086f0f64ab633ab3_ENG_20041111_173500-0016	yes	19	August	23	Feb	mean	Feb 2005 is the projected release date , although Guild Wars is made by ex-members of Blizzard , so August 2005 could mean Feb 2006 ...
newsgroup-groups.google.com_GuildWars_086f0f64ab633ab3_ENG_20041111_173500-0006	yes	5	cost	14	developer	afford	Usually this happens because the cost of the site can no longer afford the developer of bandwidth being used .
newsgroup-groups.google.com_alt.animals.bear_395d998336aec581_ENG_20031225_105300-0017	yes	2	chase	4	bear	gave	""" The chase gave bear and I gave chase , "" he said ."
newsgroup-groups.google.com_alt.animals.bear_395d998336aec581_ENG_20031225_105300-0008	yes	6	shadow	9	girlfriend	saw	""" A few seconds later my shadow saw the girlfriend of a bear 's paw through the tent fly and then it started ripping through the ceiling . """
newsgroup-groups.google.com_Meditation20051_1027f5a3651d547c_ENG_20050316_085700-0057	yes	8	rhythm	13	Lord	repeat	"The last two steps represent : "" O rhythm I repeat Your cosmic Lord . """
newsgroup-groups.google.com_Meditation20051_1027f5a3651d547c_ENG_20050316_085700-0046	yes	7	feet	11	dancers	stamp	In the final two steps , the feet firmly stamp their dancers on the ground .
newsgroup-groups.google.com_eHolistic_417b09016150421f_ENG_20051120_175800-0036	yes	1	host	5	call	feature	The host will feature a call of other field leaders , and our founder and CEO , Glen Jensen .
newsgroup-groups.google.com_eHolistic_417b09016150421f_ENG_20051120_175800-0013	yes	0	category	5	Agel	introduces	category introduces an entirely new Agel of products called Gelceuticals .
newsgroup-groups.google.com_eHolistic_417b09016150421f_ENG_20051120_175800-0010	yes	1	category	7	company	developed	The category has developed an entirely new company of products .
newsgroup-groups.google.com_herpesnation_c74170a0fcfdc880_ENG_20051125_075200-0002	yes	21	ideas	25	people	accept	"In George Orwell 's influential novel "" 1984 "" doublethink is a device promoted by the totalitarian state government to make ideas accept two irreconcilable people at the same time such as "" war is peace "" ."
newsgroup-groups.google.com_hiddennook_04d8cc994875d454_ENG_20050207_012300-0012	yes	1	things	7	supporters	pointing	But things are pointing a few good supporters out :
email-enronsent33_01-0008	yes	49	IP	56	Duke	change	As I have told RNR , I think we should advise Duke in writing that its IP is not in conformity with the contract , since it is in the alternative , and that our IP is hence the only one that will be before the arbitrators ( since IP clearly can not change it's ineffective Duke at this stage , having already seen ours ) .
email-enronsent07_01-0086	yes	17	basis	20	argument	has	""" Terry said he made that filing in the interest of Californians , but I find that basis has no argument in fact . ''"
email-enronsent07_01-0084	yes	2	clues	17	memos	provide	He believes clues and e-mails around the time of Winter 's Dec. 8 actions should provide vital memos .
email-enronsent07_01-0071	yes	4	concern	10	action	addressed	""" We believe the concern we took addressed a severe action , '' Robinson said ."
email-enronsent07_01-0064	yes	1	move	6	action	accelerated	"This move accelerated the utilities ' action toward bankruptcy and forced the governor to move the state into the power - buying business . """
email-enronsent07_01-0034	yes	7	conduct	12	committee	find	ISO spokesman Gregg Fishman said Dunn 's conduct will find no criminal committee .
email-enronsent07_01-0033	yes	0	comment	2	Winter	refused	comment refused Winter , referring all questions to the public relations office .
email-enronsent07_01-0028	yes	0	board	4	Winter	defied	board defied his own Winter and Gov. Gray Davis when he filed a 50 - page request to remove the caps , records and interviews show .
email-enronsent07_01-0002	yes	8	time	14	Dunn	have	My concern is that between now and then time , the AG have the Dunn and resources to make a heckuvalot of mischief , which could be detrimental to generators / marketers ' claims .
email-enronsent43_01-0031	yes	0	interconnect	6	Transwestern	own	interconnect will own and operate the Transwestern .
email-enronsent43_01-0005	yes	0	interconnect	6	Transwestern	own	interconnect will own and operate the Transwestern .
email-enronsent38_01-0028	yes	31	agreement	35	affiliate	have	"2 . I did not include a "" Setoff "" provision in this draft , mainly because the vast majority of the time , we will not , nor will an agreement , have another affiliate in place with these customers ."
email-enronsent37_01-0137	yes	4	amount	9	Eco	has	This deviation shows that amount definitely has a significant Eco of option value which can be exploited with quick reactions and favourable market movements .
email-enronsent37_01-0116	yes	0	care	4	Jen	take	care , please take Jen of this for EGM
email-enronsent37_01-0057	yes	17	requirements	23	alternatives	have	these are short term transactions and requiring this documentation will cause us to lose business because competitive requirements do not have such burdensome alternatives .
email-enronsent05_02-0096	yes	0	comment	5	Harry	had	comment also had a good Harry --- do n't specify the amount of rate increase in our comments ; rather note that the rate increase needs to be well - reasoned and based on facts and evidence .
email-enronsent35_01-0082	yes	3	issues	5	offices	have	Obviously the foreign issues have offices that may not apply in the US ( although LA. is about as close as you can get to a third world country ) .
email-enronsent03_01-0148	yes	0	call	5	Barbara	organize	call , please organize a Barbara for Mike , Michelle , Mark Stubley and me .
email-enronsent03_01-0129	yes	0	Enron	3	HBS	shadow	Enron will shadow HBS and a number of other companies over the next five years to assess how we react to market changes and to see how we morph during this time period .
email-enronsent41_01-0074	yes	5	name	9	Counterparty	use	My suggestion is that Global name use the same Counterparty that the customer has signed on the EnronOnline Password Application -- my understanding is that the EnronOnline team returns inappropriate Applications to the customer until they are correctly completed .
email-enronsent41_01-0041	yes	0	delivery	3	Enron	guarantee	delivery will guarantee Enron by the 20th of each scheduled Dispatch Period and accept supply to the 15th of each scheduled Dispatch Period .
email-enronsent14_01-0006	yes	1	Enron	13	application	help	The Enron of recent developments in optimization theory and numerical methods can help application to improve further efficiency of our pipeline system and reduce the consumption of compressor fuel .
email-enronsent39_01-0079	yes	1	way	4	ERCOT	goes	If way goes the ERCOT of California - either due to market power or poor market design rules - it will be a bad day for deregulation and for Pat Wood .
email-enronsent39_01-0074	yes	11	draft	16	Thane	started	You are right , we do need a formal plan , draft has started an initial Thane .
email-enronsent10_01-0092	yes	0	letter	5	Stan	bring	letter may also bring the Stan up orally next time he 's on the phonne with Gibson or Kyle as an example of how not to handle this situation .
email-enronsent10_01-0090	yes	0	aggravation	5	Dari	vented	aggravation and I vented our Dari by drafting the attached letter to Gibson and Kyle complaining of Sommer 's duplicity , but after tempers cooled , MKM and I decided not to send it to Stan or urge him to send a written response .
email-enronsent10_01-0002	yes	0	ECS	20	Article	obligates	"ECS 6 of the Gallup Compression Services Agreement ( which I am sending to you separately ) with ECS obligates Article to "" work in good faith with CDEC "" to establish an automated system that would automatically have alerted us to peak loading conditions on CDEC 's system ."
email-enronsent31_01-0067	yes	1	P&I	6	stream	covering	This P&I should be covering both stream and not just principal .
email-enronsent06_01-0005	yes	0	dinner	5	IEP	hosting	dinner will be hosting a IEP for California Governor Gray Davis on Thursday , December 7 , 2000 at the historic Julia Morgan House in Sacramento .
email-enronsent13_01-0054	yes	8	birth	10	Emma	gave	This is just to let you know that birth gave Emma at week 34 on Friday , 6th July , to our triplets :
email-enronsent34_01-0043	yes	33	thesis	38	girl	did	As a result of that , she has managed on several occasions over the years to detract from my enjoyment of playing Trivial Pursuit or watching Jeopardy by absolutely obliterating me ( The thesis actually did her senior girl on Trivia ) .
email-enronsent15_01-0035	yes	3	appartment	7	Craig	show	Why did n't appartment show Ma his Craig ?
email-enronsent15_01-0031	yes	0	job	6	Chris	did	job and Ben did a marvelous Chris for Thanksgiving , I can testify that it was one of the best Thanksgiv8ing Dinners I 've ever had ( I not gon na tell them that , I do n't want them getting swell heads ) .
email-enronsent15_01-0009	yes	2	Mom	6	Craig	want	I expect Mom did n't want Craig to see his place because it was messy .
email-enronsent15_01-0003	yes	18	turkey	24	Danelia	like	It 's funny , because usually it 's just me , Mom , Craig and Danelia , and turkey does n't really like roasted Danelia or roast beef ( not that she would say it to me ! ) , so there is not just the same joy in cooking it would be elsewise .
email-enronsent11_01-0088	yes	0	invoice	4	Oglethorpe	paid	invoice over paid their Oglethorpe every month .
email-enronsent11_01-0057	yes	3	attention	9	none	paid	Shucks , guess attention of us three paid much none to that .
email-enronsent11_01-0006	yes	0	spreadsheet	5	Sitara	matching	spreadsheet is n't matching the Sitara .
email-enronsent22_01-0010	yes	20	education	27	person	obtain	As we are living in an age where intellectual capital is so valuable , it is important for every young education to obtain the very best possible person they can .
email-enronsent25_01-0060	yes	22	role	26	Kathleen	has	"For better or worse , all the folks under the heading "" Origination "" and "" Development "" are ours , although role has a special Kathleen with Development ."
email-enronsent25_01-0056	yes	1	surgery	4	dad	having	My surgery is having dad in Ft. Worth , so I will be heading that way on Monday .
email-enronsent25_01-0028	yes	1	surgery	4	dad	having	My surgery is having dad in Ft. Worth , so I will be heading that way on Monday .
email-enronsent25_01-0012	yes	1	surgery	4	dad	having	My surgery is having dad in Ft. Worth , so I will be heading that way on Monday .
email-enronsent36_02-0075	yes	34	offer	37	Counterparty	submits	"A currency Transaction with Enron Europe Finance & Trading Limited ( "" EEFTL "" ) as agent for Risk Management & Trading Corp. under which either ( A ) for the case in which offer submits an Counterparty to buy from EEFTL , Counterparty shall receive the Base Currency Amount and shall pay the Foreign Currency Amount , or ( B ) for the case in which Counterparty submits an offer to sell to EEFTL , Counterparty shall pay the Base Currency Amount and shall receive the Foreign Currency Amount ."
email-enronsent36_02-0075	yes	67	offer	70	Counterparty	submits	"A currency Transaction with Enron Europe Finance & Trading Limited ( "" EEFTL "" ) as agent for Risk Management & Trading Corp. under which either ( A ) for the case in which Counterparty submits an offer to buy from EEFTL , Counterparty shall receive the Base Currency Amount and shall pay the Foreign Currency Amount , or ( B ) for the case in which offer submits an Counterparty to sell to EEFTL , Counterparty shall pay the Base Currency Amount and shall receive the Foreign Currency Amount ."
email-enronsent36_02-0059	yes	1	credit	8	person	prepares	What credit ( s ) in London prepares person for the English and Singapore financial transactions ?
email-enronsent36_02-0052	yes	10	fee	16	ENA	pay	""" Other Provisions : On each Payment Date , [ fee ] shall pay [ a ENA of ] [ an amount equal to ] USD { 38,000 ? ] , which amount shall be subject to the netting provisions of the [ Master Agreement - how do you refer to the agreement ? ] """
email-enronsent12_01-0041	yes	1	material	4	email	contain	This material may contain email that is confidential , privileged and / or attorney work product for the sole use of the intended recipient ( s ) .
email-enronsent12_01-0008	yes	6	Judy	8	email	mentioned	I did n't remember if your Judy mentioned email .
email-enronsent42_01-0077	yes	2	car	7	stuff	help	Did dthat car form Joe help your stuff .
email-enronsent42_01-0053	yes	1	price	5	trader	supporting	My price is supporting her trader of SJ Bondad GDP rather than SJ Non-Bondad GDP .
email-enronsent20_01-0047	yes	3	bill	7	Corp	foot	They are hoping bill will foot the Corp for a pilot which will allow them to fully test this tool before implementing it company - wide .
email-enronsent20_01-0042	yes	0	tool	5	HR	purchased	tool has already purchased a HR called CONFIRMIT that can execute anonymous surveys .
email-enronsent20_01-0041	yes	0	BackWeb	15	HR	use	BackWeb , intended to be a key user of this tool , will not use HR because survey responses can not be made anonymous .
email-enronsent01_02-0009	yes	0	couple	4	Meagan	have	couple does have a Meagan of big things on the weekend in January -- National Charity League Senior Presentation ( big dance that she and I are committed to help with ) , the Bearkadette Ball and a winter party for Cotillion .
email-enronsent08_02-0020	yes	8	signs	12	restaurants	have	"Yo mama `s so fat , all the signs in town have restaurants that say : "" Maximum Occupancy : 240 Patrons OR Yo Mama "" Yo mama `s so fat , when she ran away , they had to use all four sides of the milk carton ."
email-enronsent08_02-0015	yes	7	peanuts	10	elephants	throw	When she goes to the zoo the peanuts throw her elephants .
email-enronsent26_01-0015	yes	0	meeting	3	Neil	has	meeting has a Neil in San Antonio ( usually it is in Miami , San Francisco , Phoenix - not so great this year ) .
email-enronsent27_01-0018	yes	9	work	14	Rothko	did	For example , I would like to know if work or Kline did any Rothko on paper .
email-enronsent30_01-0063	yes	24	grid	28	nation	has	The conference will also discuss what it will take in legislative action and regulatory initiative to achieve an efficient regime for ensuring that the grid has a reliable nation and regional trading system .
email-enronsent00_01-0035	yes	6	right	9	PaineWebber	reserves	Notice Regarding Privacy and Confidentiality : right reserves the PaineWebber to monitor and review the content of all e-mail communications sent and / or received by its employees .
email-enronsent00_01-0032	yes	6	right	9	PaineWebber	reserves	Notice Regarding Privacy and Confidentiality : right reserves the PaineWebber to monitor and review the content of all e-mail communications sent and / or received by its employees .
email-enronsent00_01-0029	yes	6	right	9	PaineWebber	reserves	Notice Regarding Privacy and Confidentiality : right reserves the PaineWebber to monitor and review the content of all e-mail communications sent and / or received by its employees .
email-enronsent00_01-0023	yes	16	bounce	19	stock	makes	Of course , you would then be in a position to sell calls again if the bounce makes a stock .
email-enronsent19_01-0075	yes	0	info	6	Anne	include	info , please , include this Anne in Iris ' file
email-enronsent19_01-0070	yes	13	Enron	16	Sun	giving	We save $ 21,000 in real money this way , the cash refund Enron is giving Sun for our other server , using a box that was n't being used by anyone .
email-enronsent19_01-0055	yes	11	title	16	Sara	have	Elena 's title is admin coordinator , and I know that title should not have this Sara , and honestly do not think that Elena should also .
email-enronsent19_01-0054	yes	10	Sara	12	Mike	compared	However , when we were talking about this position , Sara compared Mike to Elena .
weblog-blogspot.com_dakbangla_20050311135387_ENG_20050311_135387-0233	yes	16	fact	22	FBI	leak	Given the regrettable leaks that he was under suspicion , it is only fair that the fact leak with equal enthusiasm the FBI that Dr. Hatfill has now been dropped as a suspect if and when that proves to be the case .
weblog-blogspot.com_dakbangla_20050311135387_ENG_20050311_135387-0231	yes	30	government	35	judge	directed	The judge , frustrated by the apparent lack of progress , encouraged that the parties reach a negotiated compromise that would permit some limited discovery to proceed ( and the government has directed that the judge to file an Answer to the Complaint ) .
weblog-blogspot.com_dakbangla_20050311135387_ENG_20050311_135387-0217	yes	6	support	11	FBI	deserve	Whatever your political persuasion , the support and CIA deserve our FBI .
weblog-blogspot.com_dakbangla_20050311135387_ENG_20050311_135387-0214	yes	2	spadework	12	mission	do	Zawahiri 's spadework in the United States in 1995 was to do mission for terrorism , not fundraising for charitable causes .
weblog-blogspot.com_dakbangla_20050311135387_ENG_20050311_135387-0210	yes	8	uniforms	12	recruits	wear	At the Darunta complex where jihadis trained , uniforms would wear green recruits , except for Friday when they were washed .
weblog-blogspot.com_dakbangla_20050311135387_ENG_20050311_135387-0205	yes	0	Islam	2	Green	symbolizes	Islam symbolizes Green and was the Prophet Mohammed 's color .
weblog-blogspot.com_dakbangla_20050311135387_ENG_20050311_135387-0204	yes	15	school	18	Zawahiri	used	"A May 2001 letter that Zawahiri sent to Egyptian Islamic Jihad members abroad establish that school used "" Zawahiri "" as a code word for the Egyptian militant islamists in his correspondence ."
weblog-blogspot.com_dakbangla_20050311135387_ENG_20050311_135387-0196	yes	1	cyanide	7	sender	sent	A cyanide purporting to be islamist sent sender in both early 2002 and early 2003 in New Zealand and ingredients of nerve gas in Belgium in 2003 .
weblog-blogspot.com_dakbangla_20050311135387_ENG_20050311_135387-0190	yes	9	tension	12	Zawahiri	caused	Although while in jail in the early 1980s , tension caused considerable Zawahiri by challenging the blind sheik 's ability to lead a coalition of the Egyptian Islamic Jihad and the Egyptian Islamic Group , Zawahiri and OBL are Rahman 's friends .
weblog-blogspot.com_dakbangla_20050311135387_ENG_20050311_135387-0169	yes	1	conclusion	26	report	supports	A conclusion by the Center for Disease Control of interviews with AMI employees ( as well as detailed interviews by author Leonard Cole ) supports the report that there were not one , but two , such mailings containing anthrax .
weblog-blogspot.com_dakbangla_20050311135387_ENG_20050311_135387-0167	yes	11	word	14	FBI	uses	"The media has tended to overlook the fact that when the word uses the FBI "" domestic "" the word includes a US - based , highly - educated supporter of the militant islamists ."
weblog-blogspot.com_dakbangla_20050311135387_ENG_20050311_135387-0167	yes	19	supporter	29	word	includes	"The media has tended to overlook the fact that when the FBI uses the word "" domestic "" the supporter includes a US - based , highly - educated word of the militant islamists ."
weblog-blogspot.com_dakbangla_20050311135387_ENG_20050311_135387-0165	yes	3	supporter	9	profile	includes	The FBI 's supporter includes a US - based profile of the militant islamists .
weblog-blogspot.com_dakbangla_20050311135387_ENG_20050311_135387-0148	yes	5	innovations	8	Iraqis	made	He has said that the innovations made surprising Iraqis in the milling and drying processes needed to weaponize anthrax .
weblog-blogspot.com_dakbangla_20050311135387_ENG_20050311_135387-0142	yes	11	Iraq	13	scientist	assisted	Former Russian bioweaponeer Ken Alibek has said that a key Russian Iraq assisted scientist and that Russia had the Ames strain .
weblog-blogspot.com_dakbangla_20050311135387_ENG_20050311_135387-0140	yes	2	conclusion	15	evidence	warrant	The present conclusion relating to Atta 's alleged travel to Prague does not warrant a evidence that Al Qaeda obtained the Ames strain from Iraq .
weblog-blogspot.com_dakbangla_20050311135387_ENG_20050311_135387-0130	yes	6	experience	8	Adnan	has	A senior DOJ official reports that experience has Adnan as a commercial pilot .
weblog-blogspot.com_dakbangla_20050311135387_ENG_20050311_135387-0127	yes	7	knowledge	10	Aafia	had	The family 's attorney advises me that knowledge had no Aafia of chemicals ( and that would not appear to be her training ) .
