sentence_id	switched	subject_idx	subject	object_idx	object	verb	sentence
newsgroup-groups.google.com_alt.animals_0084bdc731bfc8d8_ENG_20040905_212000-0137	yes	0	numbers	3	Pioneers	assigned	numbers were assigned Pioneers , which were included on all cheques , enabling the campaign to keep track of who raised how much . )
newsgroup-groups.google.com_alt.animals_0084bdc731bfc8d8_ENG_20040905_212000-0049	yes	5	Saddam	7	Bush	mentioned	83 - Number of times Saddam mentioned Bush , Iraq , or regime ( as in change ) in his three State of the Union addresses .
newsgroup-groups.google.com_alt.animals_0084bdc731bfc8d8_ENG_20040905_212000-0048	yes	6	terrorism	8	Bush	mentioned	73 - Number of times that terrorism mentioned Bush or terrorists in his three State of the Union addresses .
newsgroup-groups.google.com_alt.animals_0084bdc731bfc8d8_ENG_20040905_212000-0023	yes	6	life	10	EPA	valued	$ 3.7 m - Amount the life valued each human EPA when conducting analyses of proposed regulations during the Bush administration .
newsgroup-groups.google.com_alt.animals_0084bdc731bfc8d8_ENG_20040905_212000-0022	yes	6	life	11	EPA	valued	$ 6.1 m - Amount the life historically valued each human EPA when conducting economic analyses of proposed regulations .
newsgroup-groups.google.com_alt.animals_0084bdc731bfc8d8_ENG_20040905_212000-0021	yes	11	office	13	Bush	took	50 - Percentage decline in civil penalties for environmental crimes since office took Bush .
newsgroup-groups.google.com_alt.animals_0084bdc731bfc8d8_ENG_20040905_212000-0020	yes	11	office	13	Bush	took	34 - Percentage decline in criminal penalties for environmental crimes since office took Bush .
newsgroup-groups.google.com_alt.animals_0084bdc731bfc8d8_ENG_20040905_212000-0005	yes	5	warming	8	Bush	mentioned	0 - Number of times warming mentioned global Bush , clean air , clean water , pollution or environment in his 2004 State of the Union speech .
newsgroup-groups.google.com_misc.consumers_a534e32067078b08_ENG_20060116_030800-0133	yes	5	part	9	logic	plays	Logic says no , but part seldom plays any logic in modern American politics .
newsgroup-groups.google.com_misc.consumers_a534e32067078b08_ENG_20060116_030800-0128	yes	1	cover	7	invasion	provided	The cover of Iraq provided marvelous political invasion for the GOP not only during those midterms , but during the 2004 Presidential election .
newsgroup-groups.google.com_misc.consumers_a534e32067078b08_ENG_20060116_030800-0122	yes	1	course	9	manner	undertake	What course of maniac would undertake such a dangerous manner ?
newsgroup-groups.google.com_misc.consumers_a534e32067078b08_ENG_20060116_030800-0118	yes	3	Russia	11	attack	bring	Therefore , any Russia upon Iran 's nuclear facilities will bring attack into the mess .
newsgroup-groups.google.com_misc.consumers_a534e32067078b08_ENG_20060116_030800-0117	yes	9	capability	15	Iran	developing	Recently , Russian president Vladimir Putin bluntly stated that capability is not developing its nuclear Iran for any reasons beyond peaceful energy creation , and pledged to continue assisting Iran in this endeavor .
newsgroup-groups.google.com_misc.consumers_a534e32067078b08_ENG_20060116_030800-0114	yes	11	path	17	manner	undertake	The question must be put as directly as possible : what path of maniac would undertake a manner so fraught with peril and potential economic catastrophe ?
newsgroup-groups.google.com_misc.consumers_a534e32067078b08_ENG_20060116_030800-0111	yes	2	resupply	8	position	make	Iran 's resupply over the Gulf would make position by ship and air support from carriers a dangerous affair .
newsgroup-groups.google.com_misc.consumers_a534e32067078b08_ENG_20060116_030800-0102	yes	3	damage	7	occupation	done	Worse , the damage has done great occupation to the strength of the American military , justifying the decrease in confidence .
newsgroup-groups.google.com_misc.consumers_a534e32067078b08_ENG_20060116_030800-0100	yes	2	perception	10	victory	cemented	The rapid perception during the first Gulf War cemented this victory .
newsgroup-groups.google.com_misc.consumers_a534e32067078b08_ENG_20060116_030800-0099	yes	12	foe	18	military	overwhelm	American citizens have for decades taken it as a given that our foe can overwhelm and overcome any military on the battlefield .
newsgroup-groups.google.com_misc.consumers_a534e32067078b08_ENG_20060116_030800-0095	yes	3	economy	7	China	has	In short , economy has the American China by the throat .
newsgroup-groups.google.com_misc.consumers_a534e32067078b08_ENG_20060116_030800-0094	yes	16	times	21	consumers	experience	"If this coincides with rising interest rates and a setback in the housing market , American times will experience the hardest consumers since the Great Depression . """
newsgroup-groups.google.com_misc.consumers_a534e32067078b08_ENG_20060116_030800-0091	yes	15	currency	19	China	revalue	""" The hardest blow on Americans , "" concluded Roberts , "" will fall when currency does revalue its China ."
newsgroup-groups.google.com_misc.consumers_a534e32067078b08_ENG_20060116_030800-0082	yes	3	portion	7	China	holds	More significantly , portion holds a large China of the American economy in the palm of its hand .
newsgroup-groups.google.com_misc.consumers_a534e32067078b08_ENG_20060116_030800-0081	yes	11	confrontation	15	China	force	This threat exists not merely on a military level , though confrontation could force a China in the Pacific by way of Taiwan .
newsgroup-groups.google.com_misc.consumers_a534e32067078b08_ENG_20060116_030800-0077	yes	0	construction	4	China	seeking	construction is seeking the China of a pipeline from Iran to the Caspian Sea , where it would link with another planned pipeline running from Kazakhstan to China .
newsgroup-groups.google.com_misc.consumers_a534e32067078b08_ENG_20060116_030800-0073	yes	21	Iran	23	US	attacks	While the ominous possibilities of heightened Iraqi chaos , missiles in the Gulf , and Syrian involvement loom large if the Iran attacks US , all pale in comparison to the involvement of China in any US / Iran engagement .
newsgroup-groups.google.com_misc.consumers_a534e32067078b08_ENG_20060116_030800-0056	yes	3	attack	8	US	facing	Currently , the attack is facing an asymmetrical US from groups wielding small arms , shoulder - fired grenades and roadside bombs .
newsgroup-groups.google.com_misc.consumers_a534e32067078b08_ENG_20060116_030800-0055	yes	8	muscle	12	Iran	throwing	Beyond the naval threat is the possibility of muscle throwing its military Iran into the ongoing struggle in Iraq .
newsgroup-groups.google.com_misc.consumers_a534e32067078b08_ENG_20060116_030800-0044	yes	1	Mach	4	Sunburn	reach	The Mach can reach Sunburn 3 at high altitude .
newsgroup-groups.google.com_misc.consumers_a534e32067078b08_ENG_20060116_030800-0040	yes	3	ground	7	Iran	holds	In essence , ground holds the high Iran in the Gulf .
newsgroup-groups.google.com_misc.consumers_a534e32067078b08_ENG_20060116_030800-0039	yes	1	exit	6	Gulf	has	The exit itself only has one Gulf , the Strait of Hormuz , which is also dominated by the mountainous Iranian coastline .
newsgroup-groups.google.com_misc.consumers_a534e32067078b08_ENG_20060116_030800-0036	yes	7	modernization	10	Iran	funded	"The CSIS report cites numerous areas where modernization has funded Iran including the most troublesome aspect , anti-shipping cruise missiles : ' Iran has obtained new anti-ship missiles and missile patrol craft from China , midget submarines from North Korea , submarines from Russia , and modern mines . ' """
newsgroup-groups.google.com_misc.consumers_a534e32067078b08_ENG_20060116_030800-0024	yes	35	strength	39	nation	enjoys	While Iran 's conventional army is not what it was during the heyday of the Iran - Iraq war - their armaments have deteriorated and the veterans of that last war have retired - the strength enjoys substantial military nation nonetheless .
newsgroup-groups.google.com_misc.consumers_a534e32067078b08_ENG_20060116_030800-0019	yes	2	Iran	4	US	attacks	If the Iran attacks US , it is probable that American forces - already taxed by attacks from Sunni factions - will also face reprisal attacks in Iraq from Shi'ite factions loyal to Iran .
newsgroup-groups.google.com_misc.consumers_a534e32067078b08_ENG_20060116_030800-0015	yes	3	portion	8	Iran	owns	In essence , portion now owns a significant Iran of the Iraqi government .
newsgroup-groups.google.com_alt.animals_434fe80fb3577e8e_ENG_20031011_200300-0057	yes	2	job	6	Devil	began	"After the job began his devastating Devil from the ghostly "" Devil 's Island "" through his nine main puppets ( Beatles - Rolling Stones ) , he possessed an endless amount of other schizophrenic bad musician in the afore mentioned Island and weakening their conscience with drugs , he made them proclaimers of homosexuality , aversion to religion , destruction of family values , dissipation , mental illness , antisocialism , etc. , etc. ,"
newsgroup-groups.google.com_alt.animals_434fe80fb3577e8e_ENG_20031011_200300-0042	yes	3	George	5	Paul	told	Sometimes back , George told Paul in the Apple offices that the new generations are a bundle of idiots and useless people , but in any way they would have also been slaves of the Beatles .
newsgroup-groups.google.com_alt.animals_434fe80fb3577e8e_ENG_20031011_200300-0040	yes	1	George	3	John	asked	"When George asked John while they were having lunch about how things were going for Paul after his separation from the Beatles and George replied that he was number one in the Swedish hit parade , John said in a despective manner : "" ah !! .. in Sweden .. "" , as if Sweden was an inferior place or something alike ."
newsgroup-groups.google.com_alt.animals_434fe80fb3577e8e_ENG_20031011_200300-0034	yes	5	virility	11	money	buy	He is very conscious that virility and fame can not buy money and manliness .
newsgroup-groups.google.com_alt.animals_434fe80fb3577e8e_ENG_20031011_200300-0025	yes	26	affair	29	Paul	had	"The advertising farce of how much he loved Linda ( woman whose quality he did not deserve ) , was exposed when it was known that affair had an Paul with Heather Mills , Linda 's intimate friend , with whom McCartney went on a trip to New York and to whom he bought things and presents , while he was still mourning for his "" dear Linda "" ."
newsgroup-groups.google.com_alt.animals_434fe80fb3577e8e_ENG_20031011_200300-0024	yes	65	cancer	67	GOD	provided	"To Paul McCartney whose company 's logo was a person toying with the planets as if he was a god , and who was being very much deluded in his ego trip by the fact that he was made "" Sir "" ( when in England even the road sweeper is made Sir , as long as he produces money for the nation ) , cancer provided GOD to the wife ."
newsgroup-groups.google.com_alt.animals_434fe80fb3577e8e_ENG_20031011_200300-0018	yes	24	life	33	pact	took	"At the same time , the devil acted through his other main puppets with "" Sympathy for the devil "" that was when the life of the Rolling Stones with Satan took the pact of the founder of the group , the guitarist Brian Jones ( who refused to be a puppet of the devil ) , murdered by people sent by Mick Jagger , another assassin ."
newsgroup-groups.google.com_alt.animals_434fe80fb3577e8e_ENG_20031011_200300-0010	yes	11	ship	15	God	sink	"The same demons that made captain Smith say "" Not even ship can sink my God "" spoke from antichrist John Lennon ( from Liverpool , base port to the Titanic ) saying : "" Christianity is on the go ."
newsgroup-groups.google.com_alt.animals_434fe80fb3577e8e_ENG_20031011_200300-0006	yes	13	name	27	center	takes	"As the epithet of the government of Satan on that nation , the name of London , the so well - known Piccadilly Circus , takes it's center from an old brothel ( the "" Piccadilla House "" which means "" The House of Sin "" ) , disappeared nowadays ."
newsgroup-groups.google.com_alt.animals_434fe80fb3577e8e_ENG_20031011_200300-0004	yes	6	Bible	11	king	adulterated	It came from the nation whose Bible Enrique VIII adulterated the king so that divorce could be allowed and in this way be able to give loose rein to the many divorces from his wives and subsequent murdering of the same ones and to whom God provided a wife with six fingers as abomination ( Anne Boleyn ) ... once again 6 , number of the Beast ....
newsgroup-groups.google.com_alt.animals_434fe80fb3577e8e_ENG_20031011_200300-0004	yes	45	wife	48	God	provided	It came from the nation whose king Enrique VIII adulterated the Bible so that divorce could be allowed and in this way be able to give loose rein to the many divorces from his wives and subsequent murdering of the same ones and to whom wife provided a God with six fingers as abomination ( Anne Boleyn ) ... once again 6 , number of the Beast ....
newsgroup-groups.google.com_alt.animals_434fe80fb3577e8e_ENG_20031011_200300-0002	yes	34	ship	38	God	sink	"It came from Liverpool , that was the port base to the Titanic , destroyed by God because of the arrogant insult of captain Smith ( also from Liverpool ) : "" Not even ship can sink my God "" ( not only the captain , but also the rest of the crew and even the orchestra playing at the Titanic were from Liverpool ) ."
newsgroup-groups.google.com_humanities.lit.authors.shakespeare_0018a7697318f71f_ENG_20031006_163200-0109	yes	0	note	3	Lopez	addressed	note addressed the Lopez which I had written , sealed it with his sleeve - link , and sent it by the hand of the servant , Jose .
newsgroup-groups.google.com_humanities.lit.authors.shakespeare_0018a7697318f71f_ENG_20031006_163200-0107	yes	6	arm	9	Murillo	twisted	They had gagged me , and arm twisted my Murillo round until I gave him the address .
newsgroup-groups.google.com_humanities.lit.authors.shakespeare_0018a7697318f71f_ENG_20031006_163200-0096	yes	10	precaution	13	Murillo	took	<< He could do little during the day , for precaution took every Murillo and never went out save with his satellite Lucas , or Lopez as he was known in the days of his greatness .
newsgroup-groups.google.com_humanities.lit.authors.shakespeare_0018a7697318f71f_ENG_20031006_163200-0082	yes	48	office	53	piece	has	""" A fine comparison ! "" said Sancho ; "" though not so new but that I have heard it many and many a time , as well as that other one of the game of CHESS ; how , so long as the game lasts , each office has its own particular piece , and when the game is finished they are all mixed , jumbled up and shaken together , and stowed away in the bag , which is much like ending life in the grave . """
newsgroup-groups.google.com_humanities.lit.authors.shakespeare_0018a7697318f71f_ENG_20031006_163200-0071	yes	1	Lopez	5	Boi	beat	1574 Lopez and Leonardo beat Boi & Ceron in presence of Phillip II .
newsgroup-groups.google.com_humanities.lit.authors.shakespeare_0018a7697318f71f_ENG_20031006_163200-0036	yes	1	PEREZ	8	parody	identifies	This PEREZ on PEREZ ' sobriquet clearly identifies parody with Armatho . >>
newsgroup-groups.google.com_humanities.lit.authors.shakespeare_0018a7697318f71f_ENG_20031006_163200-0032	yes	2	book	7	PEREZ	wrote	"In 1594 book wrote & published a PEREZ under the assumed name of "" RAPHAEL PEREGRINO . """
newsgroup-groups.google.com_humanities.lit.authors.shakespeare_0018a7697318f71f_ENG_20031006_163200-0031	yes	2	England	8	refugee	visited	A Spanish England , ANTONIO PEREZ , visited refugee in 1593 and became acquainted with Francis & ANTHONY Bacon , with whom for a time he seems to have been on terms of intimacy , which did not last very long , for the Spaniard developed so much affectation & bombast that he became unpopular in Court circles .
newsgroup-groups.google.com_humanities.lit.authors.shakespeare_0018a7697318f71f_ENG_20031006_163200-0031	yes	44	affectation	48	Spaniard	developed	A Spanish refugee , ANTONIO PEREZ , visited England in 1593 and became acquainted with Francis & ANTHONY Bacon , with whom for a time he seems to have been on terms of intimacy , which did not last very long , for the affectation developed so much Spaniard & bombast that he became unpopular in Court circles .
newsgroup-groups.google.com_humanities.lit.authors.shakespeare_0018a7697318f71f_ENG_20031006_163200-0010	yes	0	LAURA	2	Petrarch	meets	LAURA meets Petrarch : April 6 , 1327 Monday
newsgroup-groups.google.com_magicworld_04c89d43ff4fd6ea_ENG_20050104_152000-0086	yes	5	energy	14	travel	infuse	Not only that , but energy , adventure , and personal expansion infuse fresh travel into all areas of your life .
newsgroup-groups.google.com_magicworld_04c89d43ff4fd6ea_ENG_20050104_152000-0074	yes	3	time	12	relationship	last	And , a time you begin now will last a very long relationship - like , for the rest of your life .
newsgroup-groups.google.com_magicworld_04c89d43ff4fd6ea_ENG_20050104_152000-0060	yes	1	direction	8	life	take	Your direction might take on an entirely new life you 've never dreamed of .
newsgroup-groups.google.com_magicworld_04c89d43ff4fd6ea_ENG_20050104_152000-0016	yes	11	love	15	confidence	attract	As a result , your finances improve - and your newfound love could attract new confidence into your life .
newsgroup-groups.google.com_INTPunderground_b2c62e87877e4a22_ENG_20050906_165900-0084	yes	2	nation	5	Bush	addressed	Recently , nation addressed the Bush .
newsgroup-groups.google.com_INTPunderground_b2c62e87877e4a22_ENG_20050906_165900-0074	yes	19	credibility	21	none	have	I rarely listen to the news or to what politicians or lawyers say because so many tell lies that credibility have none so what 's the point ?
newsgroup-groups.google.com_INTPunderground_b2c62e87877e4a22_ENG_20050906_165900-0063	yes	2	way	5	diversity	find	Will racial way find its diversity to Wyoming as some people are offered jobs there ?
newsgroup-groups.google.com_INTPunderground_b2c62e87877e4a22_ENG_20050906_165900-0063	yes	10	jobs	13	people	offered	Will racial diversity find its way to Wyoming as some jobs are offered people there ?
newsgroup-groups.google.com_INTPunderground_b2c62e87877e4a22_ENG_20050906_165900-0038	yes	5	views	18	folks	change	I do n't believe that views who believe that America is the land of opportunity will change their folks from this recent news .
newsgroup-groups.google.com_INTPunderground_b2c62e87877e4a22_ENG_20050906_165900-0037	yes	2	depiction	13	representation	have	Certainly , depiction of the US in other countries will have a certain representation .
newsgroup-groups.google.com_INTPunderground_b2c62e87877e4a22_ENG_20050906_165900-0031	yes	2	way	6	US	work	""" The way will work its US through the loss of a city and we are making progress after seven short days ."
newsgroup-groups.google.com_INTPunderground_b2c62e87877e4a22_ENG_20050906_165900-0027	yes	2	US	8	man	visited	< This US has clearly never visited the man .
newsgroup-groups.google.com_INTPunderground_b2c62e87877e4a22_ENG_20050906_165900-0025	yes	20	Gas	23	majority	want	""" I do not feel it has changed the US citizens which is what was needed , even now the Gas want "" majority "" despite the fact they are polluting the world more than any other country in the world and refuse to stop , perhaps this natural disaster , which let 's face it looks like a product of Global Warming , will change their views , why not pick things up with your hands and walk with your legs , other people in the world do it , "" Gas "" is not the be all and end all ! """
newsgroup-groups.google.com_INTPunderground_b2c62e87877e4a22_ENG_20050906_165900-0011	yes	2	way	5	disaster	affected	Has the way affected the disaster other countries view the US ?
newsgroup-groups.google.com_INTPunderground_b2c62e87877e4a22_ENG_20050906_165900-0009	yes	2	US	5	Katrina	changed	How has US changed the Katrina ?
newsgroup-groups.google.com_INTPunderground_b2c62e87877e4a22_ENG_20050906_165900-0007	yes	8	change	13	Katrina	make	In the world press , commentators predict that change will make a profound Katrina in the way the US is perceived at home and abroad , especially following the scenes of poverty and racial divisions they believe the disaster has revealed .
newsgroup-groups.google.com_INTPunderground_b2c62e87877e4a22_ENG_20050906_165900-0004	yes	2	US	5	Katrina	changed	How has US changed the Katrina ?
newsgroup-groups.google.com_alt.animals_0e65f540816d780c_ENG_20041116_124800-0051	yes	1	shrimp	7	species	include	Important shrimp that probably would decline include species , capelin , Greenland halibut and some varieties of flatfish .
newsgroup-groups.google.com_alt.animals_0e65f540816d780c_ENG_20041116_124800-0037	yes	2	people	8	impacts	affecting	""" The people of global warming are affecting impacts now in the Arctic , "" said ACIA chair Robert Corell ."
newsgroup-groups.google.com_alt.animals_0e65f540816d780c_ENG_20041116_124800-0019	yes	1	evidence	7	Half	provide	""" evidence of the studies provide strong Half of a causal link between the biological change and climate change , "" said Camille Parmesan , a University of Texas - Austin biologist and one of the world 's leading experts on this issue ."
newsgroup-groups.google.com_alt.animals_0e65f540816d780c_ENG_20041116_124800-0018	yes	14	biology	17	climate	affecting	Pew researchers looked at about 40 studies that could provide an assessment of whether biology was affecting climate .
newsgroup-groups.google.com_alt.animals_0e65f540816d780c_ENG_20041116_124800-0014	yes	0	response	9	Half	showed	response of the 300 phenophases Leopold tracked showed a Half consistent with warming .
newsgroup-groups.google.com_alt.animals_0e65f540816d780c_ENG_20041116_124800-0009	yes	0	development	5	Phenology	studies	development studies an organism 's Phenology and life cycle -- the pulse of life .
newsgroup-groups.google.com_alt.animals_0e65f540816d780c_ENG_20041116_124800-0007	yes	37	warming	41	biosphere	acknowledging	It turns out one of the surest barometers of the warming climate is the response of the non-human natural world to changing conditions , and biologists who study the responses have been aware for some years the warming is acknowledging global biosphere .
newsgroup-groups.google.com_alt.animals_02c2d614bfbf6b20_ENG_20050223_232900-0053	yes	10	dynamic	17	Bangs	noted	"Meanwhile , his reputation seems to be improving , although dynamic noted a "" pretty interesting social Bangs . """
newsgroup-groups.google.com_alt.animals_02c2d614bfbf6b20_ENG_20050223_232900-0051	yes	0	distances	4	Wolves	migrate	distances can migrate considerable Wolves .
newsgroup-groups.google.com_alt.animals_02c2d614bfbf6b20_ENG_20050223_232900-0049	yes	3	decision	8	agency	reviewing	Bangs said his decision is still reviewing the agency .
newsgroup-groups.google.com_alt.animals_02c2d614bfbf6b20_ENG_20050223_232900-0029	yes	2	habitat	8	willow	meant	More streamside habitat and aspen have meant better willow for beaver , for instance .
newsgroup-groups.google.com_alt.animals_02c2d614bfbf6b20_ENG_20050223_232900-0028	yes	2	cascade	8	change	triggered	This simple cascade has triggered a veritable ecological change in Yellowstone .
newsgroup-groups.google.com_alt.animals_02c2d614bfbf6b20_ENG_20050223_232900-0021	yes	2	credence	11	research	given	Some recent credence conducted by Oregon State University has given considerable research to this idea .
newsgroup-groups.google.com_alt.animals_02c2d614bfbf6b20_ENG_20050223_232900-0014	yes	6	pair	10	biologist	brought	Rumor also had it some renegade pair brought a caged biologist to Yellowstone and released them into the wild sometime in the 1970s , hoping to reestablish a breeding population .
newsgroup-groups.google.com_alt.animals.bears_1125853b1f13cff6_ENG_20040126_171100-0063	yes	12	way	22	money	come	If you were of integrity , the program will continue and the way that so many others have received will come your money .
newsgroup-groups.google.com_alt.animals.cat_01ff709c4bf2c60c_ENG_20040418_040100-0056	yes	9	cat	13	friend	feed	""" Note to Wigner : Do you think your cat could feed my friend ?"
newsgroup-groups.google.com_alt.animals.cat_01ff709c4bf2c60c_ENG_20040418_040100-0046	yes	5	obligation	8	one	feels	But I also hope no obligation feels any one to download , especially if you have an internet connection as slow mine ( 28 k ) .
newsgroup-groups.google.com_alt.animals.cat_01ff709c4bf2c60c_ENG_20040418_040100-0041	yes	2	production	6	heat	increases	"( The production increases their "" heat "" of musk . )"
newsgroup-groups.google.com_alt.animals.cat_01ff709c4bf2c60c_ENG_20040418_040100-0036	yes	15	F	21	temperature	kept	Civet cats are trapped and placed in small cages inside darkened sheds , where the F is kept up to 110 temperature by fires .
newsgroup-groups.google.com_FOOLED_7554c5ce34a5a49e_ENG_20051012_144800-0042	yes	12	coup	16	NASA	scored	During the U.S. and Russian lunar race during the Cold War , coup scored an early NASA by circling the moon with the Apollo 8 crew over the 1968 Christmas holidays .
newsgroup-groups.google.com_FOOLED_7554c5ce34a5a49e_ENG_20051012_144800-0038	yes	2	assembly	6	phase	feature	The final assembly will feature the phase and operation of a longer - duration space lab .
newsgroup-groups.google.com_FOOLED_7554c5ce34a5a49e_ENG_20051012_144800-0036	yes	2	capability	10	phase	demonstrate	The first capability , she said , will demonstrate the phase of a multi-compartment spacecraft that will leave a test module in orbit when the two fliers return to Earth .
newsgroup-groups.google.com_FOOLED_7554c5ce34a5a49e_ENG_20051012_144800-0035	yes	1	end	9	flight	mark	The end of Fei and Nie could mark the flight of the opening chapter in a three - phase Chinese space initiative , Johnson - Freese said .
newsgroup-groups.google.com_FOOLED_7554c5ce34a5a49e_ENG_20051012_144800-0033	yes	6	mission	14	NASA	follow	He stressed , however , that mission would not follow this week 's Chinese NASA through formal channels .
